{
  "schema": "xr-foundry.work_packets.v1",
  "version": "0.1.0",
  "policy": {
    "packet_grants_no_permission": true,
    "acceptance_is_machine_checked_where_possible": true,
    "done_needs_proof_path": true,
    "disjoint_allowed_paths_run_in_parallel": true
  },
  "packets": [
    {
      "id": "WP-001",
      "title": "Locomotion and comfort source gate",
      "milestone_batch": "2c",
      "needs": "none",
      "decision_class": "routine",
      "size": "medium",
      "status": "open",
      "depends_on": [],
      "read_first": [
        "AGENTS.md",
        "docs/foundry/system-admission.md",
        "docs/standards/audio/README.md",
        "docs/standards/audio/source-manifest.json",
        "docs/standards/audio/verification-contract.md",
        "docs/standards/audio/admission.draft.json",
        "docs/standards/lessons/lessons-register.json"
      ],
      "allowed_paths": ["docs/standards/locomotion/", "docs/foundry/queue/next-batch.json"],
      "steps": [
        "Write docs/standards/locomotion/source-manifest.json naming only admitted positive public sources (engine locomotion documentation, platform comfort guidelines, maintained open-source locomotion implementations) with role, admitted claims, limits, and license boundary per source; mark every URL as not fetched unless a person confirmed it.",
        "Write docs/standards/locomotion/verification-contract.md with a Core gate (teleport, snap turn, smooth turn, continuous move, and comfort policy as engine-light intents and immutable state with stable failure codes) and a Unity adapter gate (thin binding to the XR Interaction Toolkit locomotion providers with explicit diagnostics for every by-name resolution), plus a claim ceiling that names motion-sickness, comfort, and device behaviour as device-evidence only.",
        "Write docs/standards/locomotion/README.md with a disposition row for every lesson in the lessons register, and docs/standards/locomotion/admission.draft.json in the shape of the audio draft.",
        "Add a NEXT-LOCOMOTION-COMFORT candidate to docs/foundry/queue/next-batch.json with state proposal, no package_ids, and no placeholder text."
      ],
      "acceptance": {
        "commands": ["python scripts/validate_repository.py --json", "python -m unittest discover -s tests -p \"test_*.py\""],
        "artifacts": [
          "docs/standards/locomotion/README.md",
          "docs/standards/locomotion/source-manifest.json",
          "docs/standards/locomotion/verification-contract.md",
          "docs/standards/locomotion/admission.draft.json"
        ]
      },
      "evidence": "The four artifacts in the tree and a merge-readiness verdict with repository_contract pass on the pull request.",
      "done_proof": null
    },
    {
      "id": "WP-002",
      "title": "Locomotion and comfort staged Core and Unity adapter",
      "milestone_batch": "2c",
      "needs": "none",
      "decision_class": "routine",
      "size": "large",
      "status": "open",
      "depends_on": ["WP-001"],
      "read_first": [
        "AGENTS.md",
        "staging/audio/README.md",
        "docs/standards/audio/verification-contract.md",
        "docs/standards/audio/coverage-map.json"
      ],
      "allowed_paths": ["staging/locomotion/", "docs/standards/locomotion/coverage-map.json", "docs/standards/locomotion/README.md"],
      "steps": [
        "Read docs/standards/locomotion/verification-contract.md, which WP-001 produced, then author staging/locomotion/com.lingkyn.locomotion.core and com.lingkyn.locomotion.unity with package.staging.json, asmdefs, Runtime sources, NUnit EditMode tests, and a domain-only sample, modelled on staging/audio.",
        "Write docs/standards/locomotion/coverage-map.json mapping every contract clause to named tests; every listed test must exist and every test must be listed.",
        "Write staging/locomotion/README.md with the status line, the what-is-here table, the promotion steps, and the statement that the code is authored and unexecuted."
      ],
      "acceptance": {
        "commands": ["python scripts/validate_repository.py --json", "python -m unittest tests.test_coverage_claims"],
        "artifacts": ["staging/locomotion/README.md", "docs/standards/locomotion/coverage-map.json"]
      },
      "evidence": "validate_coverage_map_claims passes on the new map with no allowlist entry.",
      "done_proof": null
    },
    {
      "id": "WP-003",
      "title": "Scene flow source gate",
      "milestone_batch": "2c",
      "needs": "none",
      "decision_class": "routine",
      "size": "medium",
      "status": "open",
      "depends_on": [],
      "read_first": [
        "AGENTS.md",
        "docs/foundry/system-admission.md",
        "docs/standards/audio/source-manifest.json",
        "docs/standards/audio/verification-contract.md",
        "docs/standards/lessons/lessons-register.json"
      ],
      "allowed_paths": ["docs/standards/scene-flow/", "docs/foundry/queue/next-batch.json"],
      "steps": [
        "Write the source manifest, verification contract (Core gate: scene set identity, load and unload intents, transition state machine with fade and hold, error recovery with stable codes; Unity adapter gate: thin binding over additive scene loading with explicit diagnostics), README with lesson dispositions, and admission draft for the Scene flow family.",
        "Add a NEXT-SCENE-FLOW candidate to the queue with state proposal and no package_ids."
      ],
      "acceptance": {
        "commands": ["python scripts/validate_repository.py --json", "python -m unittest discover -s tests -p \"test_*.py\""],
        "artifacts": [
          "docs/standards/scene-flow/README.md",
          "docs/standards/scene-flow/source-manifest.json",
          "docs/standards/scene-flow/verification-contract.md",
          "docs/standards/scene-flow/admission.draft.json"
        ]
      },
      "evidence": "The four artifacts in the tree and a passing repository contract.",
      "done_proof": null
    },
    {
      "id": "WP-004",
      "title": "Scene flow staged Core and Unity adapter",
      "milestone_batch": "2c",
      "needs": "none",
      "decision_class": "routine",
      "size": "large",
      "status": "open",
      "depends_on": ["WP-003"],
      "read_first": ["AGENTS.md", "staging/audio/README.md", "docs/standards/audio/verification-contract.md"],
      "allowed_paths": ["staging/scene-flow/", "docs/standards/scene-flow/coverage-map.json", "docs/standards/scene-flow/README.md"],
      "steps": [
        "Read docs/standards/scene-flow/verification-contract.md, which WP-003 produced, then author the staged Core and Unity adapter packages with tests and a sample, modelled on staging/audio.",
        "Write the coverage map and the staging README."
      ],
      "acceptance": {
        "commands": ["python scripts/validate_repository.py --json", "python -m unittest tests.test_coverage_claims"],
        "artifacts": ["staging/scene-flow/README.md", "docs/standards/scene-flow/coverage-map.json"]
      },
      "evidence": "validate_coverage_map_claims passes on the new map with no allowlist entry.",
      "done_proof": null
    },
    {
      "id": "WP-005",
      "title": "XR UI shell source gate",
      "milestone_batch": "2c",
      "needs": "none",
      "decision_class": "routine",
      "size": "medium",
      "status": "open",
      "depends_on": [],
      "read_first": [
        "AGENTS.md",
        "docs/foundry/system-admission.md",
        "docs/standards/design-language/README.md",
        "docs/standards/inventory/README.md",
        "docs/standards/audio/verification-contract.md",
        "docs/standards/lessons/lessons-register.json"
      ],
      "allowed_paths": ["docs/standards/xr-ui-shell/", "docs/foundry/queue/next-batch.json"],
      "steps": [
        "Write the source manifest, verification contract (Core gate: panel, wrist and hand menu, pointer and gaze routing as renderer-neutral intents and state; adapter gates for UGUI and UI Toolkit as siblings with one injectable skin seam mapping the shared design-language tokens), README with lesson dispositions, and admission draft for the XR UI shell family.",
        "State how the Inventory presentation adapters become one client of the shell without transferring any Inventory evidence.",
        "Add a NEXT-XR-UI-SHELL candidate to the queue with state proposal and no package_ids."
      ],
      "acceptance": {
        "commands": ["python scripts/validate_repository.py --json", "python -m unittest discover -s tests -p \"test_*.py\""],
        "artifacts": [
          "docs/standards/xr-ui-shell/README.md",
          "docs/standards/xr-ui-shell/source-manifest.json",
          "docs/standards/xr-ui-shell/verification-contract.md",
          "docs/standards/xr-ui-shell/admission.draft.json"
        ]
      },
      "evidence": "The four artifacts in the tree and a passing repository contract.",
      "done_proof": null
    },
    {
      "id": "WP-006",
      "title": "Source manifests of every family are machine-checked",
      "milestone_batch": "1a",
      "needs": "none",
      "decision_class": "routine",
      "size": "medium",
      "status": "open",
      "depends_on": [],
      "read_first": ["AGENTS.md", "docs/validation/checked-claims.md", "scripts/validate_repository.py", "tests/test_coverage_claims.py"],
      "allowed_paths": ["scripts/validate_repository.py", "tests/test_source_manifests.py", "docs/validation/checked-claims.md", "CHANGELOG.md"],
      "steps": [
        "Generalise validate_inventory_source_manifest into a rule that validates docs/standards/*/source-manifest.json for every family with the same admission, HTTPS, role, evidence, and license-boundary requirements, keeping the Inventory rule's behaviour unchanged.",
        "Add fix hints, a test module, and move the register row from self-declared to machine-checked."
      ],
      "acceptance": {